Россия	Москва	Точка опоры	м. Курская/Чкаловская, 6 выход, 3-й Сыромятнический переулок 3/9с1, 4 этаж. Пояснение: Как добраться: https://yandex.ru/maps/-/CHSq7OLT Выход из метро Курская/Чкаловская №6, идите прямо до Курского вокзала и поверните направо, далее прямо до дома 3/9с1 на 3-й Сыромятническом переулке, у дома поверните налево в арку, вторая дверь справа, на лифте на 4 этаж, комната с табличкой «Точка опоры». Темы собраний: Понедельник 20:00: Чтение отрывка из БКК; Вторник 20:00: Собрание для новичков + Мини-спикерская по 1 Шагу + Черты выживания; Среда 15:00: Ежедневник + Текущий опыт выздоровления; Среда 20:00: Ежедневник + Две свободные темы от участников собрания; Четверг 20:00: Чтение 8 главы из БКК «Решение: стать себе Любящим Родителем»; Пятница 20:00: Две черты выживания +Текущий опыт выздоровления +Вопросы из блокнота; Суббота 19:00: Ежедневник + Чтение отрывка из БКК (2-я суббота месяца: Большая спикерская) Воскресенье 19:00: Две черты из оборотного списка «К чему мы придем в выздоровлении». Веб-представительство: https://t.me/tochka_vda. Телефон: +7 985-887-18-13. Контактное лицо: Александра. E-mail: tochka@vdamoscow.ru	Понедельник с 20:00 до 21:30; Вторник с 20:00 до 21:30; Среда с 15:00 до 16:30 и с 20:00 до 21:30; Четверг с 20:00 до 21:30; Пятница с 20:00 до 21:30; Суббота с 19:00 до 20:30; Воскресенье с 19:00 до 20:30.
Россия	Москва	Четвертая черта	ул. Казакова, 8с2, 3 этаж, 315 каб. Пояснение: Схема прохода размещена в нашем тг канале. Веб-представительство: https://t.me/chetvertayacherta. Контактное лицо: Валерия. E-mail: vdacherta@yandex.ru	Понедельник, 20:00: Изучение традиций, Черты выживания и текущий опыт выздоровления. Вторник, 20:00: Чтение БКК и текущий опыт выздоровления. Среда, 20:00: Спикерская по Первому шагу и текущий опыт выздоровления. Среда, 22:00: Чтение путеводителя по Любящему родителю и текущий опыт выздоровления. Четверг, 20:00: Ежедневник и текущий опыт выздоровления. Пятница, 20:00: Шаги ВДА, вопросы из блокнота и текущий опыт выздоровления. Суббота, 20:00: Чтение БКК и текущий опыт выздоровления (вторая и последняя суббота каждого месяца — «Спикерская» и рабочее собрание в 21:45; если в месяце пять суббот, то третья и последняя суббота). Воскресенье, 20:00: Черты выживания и текущий опыт выздоровления.
Россия	Санкт-Петербург	Выход	м. Технологический институт. ул. Егорова, 11, цокольный этаж, вход с улицы, помещение «Хаски». Телефон: +7 911 995-25-35, Евгения.	Понедельник с 15.00 до 16.00
Россия	Санкт-Петербург	Невская	м. Ломоносовская. пер. Челиева, д. 10Б, на территории Подворья Свято-Троицкого Александра Свирского мужского монастыря. Телефон: +7 911 964-73-58.	Понедельник в 20.20
Россия	Санкт-Петербург	Подруги	Женская группа. м. Владимирская, Достоевская. Щербаков переулок, д. 12, ДЦ «Владимирский». VK: vk.com/spb_aca_girls. Telegram: t.me/spb_aca_girls.	Понедельник с 19.00 до 20.00
Россия	Санкт-Петербург	Феникс	м. Василеостровская, Спортивная. 2-я линия В.О., д. 3, «Информационный кабинет», лестница вниз. Телефон: +7 965 787-05-74.	Понедельник в 19.00; Среда в 19.00; Пятница в 19.00; Суббота в 19.00; Воскресенье в 15.10
Россия	Санкт-Петербург	Петроградка	м. Петроградская. Большой проспект П. С., 77. Деревянная дверь выходит на остановку, код домофона 3, третий этаж, белая дверь напротив входа. Телефон: +7 911 022-95-07.	Среда в 19.00; Пятница в 19.00; Суббота в 17.00
Россия	Санкт-Петербург	Лотос	м. Ленинский проспект. Трамвайный пр., д. 12к2, 5 этаж, комната 33. Телефон: +7 921 904-49-86. VK: vk.com/club188163037.	Вторник в 17.30
Россия	Санкт-Петербург	Вместе	м. Технологический институт. 1-я Красноармейская ул., д. 11, Собор Успения Пресвятой Девы Марии, цокольный этаж: через главный зал направо вниз по лестнице, затем направо по коридору, по указателям. Телефон: +7 921 633-43-32, Алёна.	Вторник с 18.45 до 20.00; Четверг с 18.45 до 20.00
Россия	Санкт-Петербург	Черта	м. Площадь Ленина, Площадь Мужества, Новочеркасская. Пискарёвский пр., д. 25, вход между Фитнес Хаусом и Евразией, на лифте 4 этаж, помещение 5. Воскресенье 14:30–15:00 — практика по восстановлению связи с Любящим родителем.	Вторник в 18.45; Четверг в 18.45; Воскресенье с 13.00 до 14.00; Воскресенье с 14.30 до 15.00
Россия	Санкт-Петербург	Взрослые девочки	Женская группа. м. Василеостровская. 13-я линия В.О., д. 2, кв. 46, синяя дверь во дворе. Телефон: +7 911 156-54-77, Наталья. VK: vk.com/aca_girls_spb. Каждую субботу в 11:00 проходит открытый интенсив для женщин по 10 шагу ВДА по БКК и ЖТ; приглашаются все желающие, которые прошли 9 шагов.	Вторник в 19.00; Воскресенье в 11.00
Россия	Санкт-Петербург	Тепло («Азария»)	м. Садовая, Технологический институт. ул. Большая Подъяческая, д. 34, вход со двора.	Вторник в 20.20; Среда в 20.20; Пятница в 19.00
Россия	Санкт-Петербург	Чёрная речка	м. Чёрная речка. Сестрорецкая ул., д. 2. Вход с Сестрорецкой улицы через магазин «Рыбалка».	Вторник с 16.00 до 17.00
Россия	Санкт-Петербург	Говори, доверяй, чувствуй	м. Проспект Просвещения. проспект Энгельса, 132, подвальное помещение во внутреннем дворе у магазина «Бристоль». Телефон: +7 905 274-55-50, Алёна.	Суббота в 16.00
Россия	Санкт-Петербург	Солнечная сторона	м. Чернышевская. ул. Радищева, д. 30, Пространство «Просвет», зал «Просвещение».	Среда с 18.00 до 19.00; Суббота с 19.00 до 20.00
Россия	Санкт-Петербург	Прометей	м. Московская, Проспект Славы. пр. Славы, д. 4, после арки направо, вывеска «Автошкола», 2 этаж, последняя дверь налево. Телефон: +7 911 277-49-11, Анастасия. VK: vk.ru/vda_prometei.	Среда с 19.00 до 20.00; Воскресенье с 18.00 до 19.30
Россия	Санкт-Петербург	Ручей	м. Чкаловская. ул. Колпинская, д. 27, пространство выздоровления «Ручей». Рабочее собрание в последнюю среду месяца 20:15–21:15.	Среда в 19.15; Пятница в 18.10
Россия	Санкт-Петербург	13 линия	м. Василеостровская. 13-я линия В.О., д. 2, кв. 46, синяя дверь во дворе. VK: vk.com/club117132895.	Среда в 17.00; Суббота в 13.00
Россия	Санкт-Петербург	Здравствуй, Я!	м. Балтийская, Фрунзенская. Обводный канал, 116, ауд. 121, возле Варшавского вокзала. На территории Храма Воскресения Христова, в кирпичном домике, где туалеты, 1 этаж, прямо до конца коридора, направо. Телефон: +7 906 246-56-93, Марина. VK: vk.ru/club236966318.	Среда с 19.00 до 20.30
Россия	Санкт-Петербург	Свобода смысла	м. Сенная, Садовая, Спасская. ул. Ефимова, д. 6, подойти к арке, звонок справа от домофона, код от домофона 220222#. Парадная напротив арки. Домофон 57, 2 этаж. VK: vk.ru/club237107598. Группа ориентирована на агностиков и атеистов.	Четверг в 18.00; Суббота в 16.00
Россия	Санкт-Петербург	Эфир	м. Московская. ул. Варшавская, д. 122, каб. 10, цокольный этаж, домофон «6». Телефон: +7 999 037-13-05, Наталья.	Четверг с 19.00 до 20.00
Россия	Санкт-Петербург	Практика применения пособия «Любящий родитель»	м. Балтийская. наб. Обводного канала, 116, помещение «Лекционка» — в храме, центральный вход. Напротив поста охраны налево. Коричневая дверь — подняться наверх за хоры. Важно не опаздывать: в 19:30 храм закрывают под группу. Телефон: +7 952 236-77-44, Валерия.	Пятница с 19.00 до 20.30
Россия	Санкт-Петербург	Парнас	м. Парнас. 6-й Верхний переулок, д. 12Б, 5 этаж, офис №2, центральный вход, на лифте до 4 этажа, потом по лестнице до 5-го и налево по коридору. Телефон: +7 921 434-05-66, Александра.	Суббота в 17.00
Россия	Санкт-Петербург	Воскресенье	м. Автово, Юго-Западная, Ленинский проспект. ул. Маршала Захарова, д. 13, подъезд 3, цокольный этаж, домофон «222». Телефон: +7 904 638-31-78.	Воскресенье с 15.00 до 16.30
Россия	Санкт-Петербург	проСВЕТ	м. Проспект Просвещения. Выборгское ш., д. 15, вход через ТЦ «Авеню» со стороны Выборгского шоссе во внутренний двор, 3 этаж на лифте или по лестнице, по диагонали через двор налево первая дверь, первая комната налево. Телефон: +7 999 202-91-71, Екатерина; +7 964 388-52-23, Александр. Перед приходом уточнить проведение собрания.	Воскресенье в 17.00
Россия	Санкт-Петербург	Все свободны	м. Чернышевская. ул. Таврическая, 5, подробнее как пройти — в закрепах чата. Чат: t.me/vsefree_vda. Встречи открыты для всех членов 12-шаговых сообществ с правом высказывания.	Воскресенье в 16.30
Россия	Санкт-Петербург	ВДАтин	Группа для подростков 12–18 лет из алкогольных и/или дисфункциональных семей. м. Василеостровская, Спортивная. 2-я линия В.О., д. 3, «Информационный кабинет», лестница вниз. Телефон: +7 931 120-41-24. Telegram: t.me/VDAtin.	Воскресенье в 15.15
Россия	Пушкин (СПб)	Жемчужина	ул. Магазейная, д. 22/30, помещение клуба «Восхождение». Телефон: +7 969 211-26-96.	Вторник в 19.00; Суббота в 10.30
Россия	Выборг	Крылья	Выборг, ул. Кленовая, дом 2, 1 этаж. Веб-представительство: https://t.me/+FqSI0EZyIZdmODNi. Контактное лицо: Света. E-mail: Krilyavda@yandex.ru	Каждый понедельник в 19:15
Россия	Всеволожск	Решение	Дорога Жизни, д.20 (вход: средняя лестница со стороны двора, второй этаж, дверь слева). Пояснение: Дорога Жизни, д.20 (вход: средняя лестница со стороны двора, второй этаж, дверь слева). Веб-представительство: https://chat.whatsapp.com/CVa7ZCBffFA3cOp8eC2SRQ. Телефон: +7 965 790-84-63 Юрий, +7 921 369 51 58 Михаил. Контактное лицо: Михаил	Среда с 19:00 до 20:00.
Россия	Колпино (СПб)	Доверие	ул. Анисимова, 5, корп. 7, вагончик за церковью Сошествия Святого Духа. С собой нужно принести сменную обувь. Телефон: +7 911 967-25-38, Оксана.	Пятница в 10.15
Россия	Петергоф (СПб)	Петергоф	Калининская улица, 3Ж, вход со стороны Лихардовской улицы, нужная дверь справа от студии керамики «Облепиха». Берите с собой сменную обувь или бахилы. Телефон: +7 921 847-60-41, Ирина. VK: vk.com/club217670292.	Суббота в 15.00
Россия	Кириши (Ленинградская область)	ЗемляНика	Телефон: +79218919739. Контактное лицо: Николай. E-mail: nikolay-64@mail.ru	В настоящий период живые собрания приостановлены
Россия	Альметьевск	Светоч	Радищева, 47. Веб-представительство: https://chat.whatsapp.com/EkbN5oyEg3Y3Cq08vJ7CWx. Телефон: 89272482733. E-mail: trezvialmet@mail.ru	суббота 20:00 до 21:00
Россия	Ангарск	Маленький принц	Садовое кольцо 40, одноэтажное здание. Пояснение: Наша группа ВДА и если придут психологи или коучи которые знают участников, то групповым сознанием будет решение об их присутствии на данном собрании. Телефон: +79041238909. Контактное лицо: Татьяна	Четверг 17:30
Россия	Ангарск (Иркутская область)	Рассвет	Ангарск, мкрн Байкальск, ул. Садовое Кольцо, 40. Телефон: +79501436465. Контактное лицо: Артём. E-mail: probst@bk.ru	Понедельник с 19:20 до 20:50
Россия	Архангельск	Феникс	ул.Суворова д.11, 1 подъезд (код 5283) 3 эт., каб.14-15. Веб-представительство: vda-fenix@mail.ru. Телефон: +7 900 920 8880	Суббота с 17-00 до 19:00
Россия	Астрахань	Ступени	Г.Астрахань, ул. А. Королева, 8. Телефон: +7(927)285-35-86. Контактное лицо: Ольга. E-mail: BDA.Astrakhan@gmail.com	Понедельник 18:00-19:30; четверг 18:00-19:30
Россия	Балашиха	Дорога домой	микрорайон Железнодорожный, ул. Пролетарская, 8. Веб-представительство: https://max.ru/join/Gt0xFEFMiHLcfE7MOHQR4RrafwsLCDBYaoaNvVg4hEg. Телефон: +79854165354. Контактное лицо: Наталья. E-mail: mitrofanova-natalia@bk.ru	Воскресенье с 18-00 до 19-00
Россия	Балашиха	Тебе здесь рады	ул. Парковая, дом 2, офис 1081. Пояснение: Иногда бывают отмены из-за проведения игр в здании дворца. Актуальное расписание публикуется в тг-канале группы. Веб-представительство: https://t.me/+gV4LI2D6TwczMjVi. E-mail: tebe.zdesrady@mail.ru	Понедельник 19:00-20:00, Пятница 19:00-20:00
Россия	Балашиха	Ты не один	мкр. Ольгино, ул. Жилгородок, д.4А; дом культуры 'Чайка. Пояснение: Группа проходит в формате живой группы с трансляцией в Телеграмм (на входе есть тест для защиты от ботов и спама). Высказывания в следующем порядке: участники живой группы высказываются по кругу, далее присутствующие на собрании онлайн. Веб-представительство: https://t.me/+WKquBWAv2fc3NDhi. Контактное лицо: Татьяна П. E-mail: tineodin@vdamoscow.ru	Суббота 16:30-18:00 с подключением в Телеграмм. Темы собраний: Первая неделя - Шаг по номеру месяца Вторая неделя - Традиция по номеру месяца Третья неделя - СХО ( письменные задания по тетради СХО); Четвертая неделя - обещание Пятая неделя - спикерское или свободная тема
Россия	Барнаул	ВДА г. Барнаул	пр. Ленина, 54. Центр саморазвития «Грааль». Веб-представительство: https://chat.whatsapp.com/GjS53BUkNxU5x3nEG9Fb vI https://vk.com/club162106399. Телефон: +79994760484. Контактное лицо: Балашов Дмитрий. E-mail: elaben@list.ru	Каждая суббота с 11:00 до 12:30
Россия	Белгород	Тепло	г. Белгород ул. Конева 21Б, этаж 3, офис 35. Веб-представительство: https://t.me/VDA_Belgorod. Телефон: 89192283590. Контактное лицо: Максим. E-mail: teplo_vdabgd@mail.ru	Суббота с 13-15 до 14-45
Россия	Белоозерский (Воскресенского района)	Парус	ул. Российская, д.3, здание трапезной при Храме Всех Святых. Телефон: +79999899033. Контактное лицо: Мария. E-mail: melory_88@mail.ru	Понедельник с 18:15 до 19:50
Россия	Белореченск	Дар	ул. Толстого 41. Пояснение: Собрания группы проводятся по вторникам в 19:00 в Духовно-образовательном центре православия по ул. Толстого 41 напротив храма Успения Пресвятой Богородицы города Белореченска	Вторник 19:00
Россия	Бердск	Феникс	ул. Микрорайон 15Б, «Ресурсный центр». Веб-представительство: https://t.me/vda_berdsk. Телефон: +79134654868. Контактное лицо: Татьяна. E-mail: vda.berdsk@yandex.ru	СРЕДА с 19-00 до 20-30
Россия	Бор, Нижегородская область	Лето	Улица Ленина 84, офис 317 (3 этаж). Веб-представительство: https://t.me/c/2652962450/1. Телефон: 89030562772. Контактное лицо: Татьяна. E-mail: vdaletobor@mail.ru	Каждое воскресенье с 12-00ч до 14-00ч
Россия	Брянск	ВДА Брянск	Переулок Осоавиахима 3А, 4 этаж, 406 кабинет. Пояснение: Добавочный номер: 8 960 561 16 60. Телефон: 89003601992. Контактное лицо: Анна	СБ с 18:00-19:00
Россия	Великий Новгород	Маяк	"1). Ул. Славная, д. 55А, в помещении ОАЦ (по вторникам) 2). Ул. Кочетова, д. 35, кор.3. В помещении клуба ""Юность"" (по четвергам). Пояснение: отдельный вход крыльцо со ступеньками. Веб-представительство: https://vk.com/club229137570. Телефон: +79052918866"	Вторник с 19 до 20:15; Четверг с 19:30 до 20:45
Россия	Владивосток	На Гоголя	Гоголя, 35. Телефон: +7 (908) 992-59-83	Среда 18:30 до 20:00
Россия	Владивосток (Приморский край)	Подснежник	ул. Володарского, д.22. Веб-представительство: WhatsApp. Телефон: +79089925983. Контактное лицо: Екатерина	Суббота с 14-00 до 16-00
Россия	Владимир	Радуга	г. Владимир, ул. Большая Нижегородская, д. 80 В, 2 этаж. Веб-представительство: https://vk.com/vda33. Телефон: +7-960-734-29-16. E-mail: raduga.vda.vladimir@gmail.com	вторник с 18:30 до 19:30
Россия	Волгоград	Вместе	Волгоград, ул. Донецкая д. 16, офис 402 (домофон 402). Пояснение: онлайн группа: Среда с 19:00 до 20:30. Телефон: +7 (902) 360-10-05. Контактное лицо: Ирина. E-mail: vdavmeste34@gmail.com	Воскресенье с 17-00 до 18-45
Россия	Волгодонск	Домашний Огонек	ул.М.Кошевого д. 9В. Пояснение: группа проходит не регулярно, предварительно позвонить. Веб-представительство: https://t.me/vda_vld. Телефон: +79286188161	Пятница с 18:30 до 19:30
Россия	Вологда	Начало	г. Вологда, Проспект Победы, дом 33, офис 208. Телефон: +79217161566	Воскресенье 17:00
Россия	Воронеж	Белые ночи	ул. Цурюпы, 34, 3 этаж. Веб-представительство: https://vk.com/vda.voronezh. Телефон: +79507670905. E-mail: mm-k@yandex.ru	Среда с 19-00 до 20-30
Россия	Воронеж	Путь	25 лет Октября, 17А. Пояснение: собрания проходят на территории Церкови Богоявления Господня. Веб-представительство: https://chat.whatsapp.com/E0fKYeMn1i0Loxt0K8iynk. Телефон: +7(920) 212-75-95 Марина; +7 (951) 851-55-24 Люба. E-mail: vda.put@bk.ru	собрания проходят по вторникам с 19:00 до 20:30 и субботам с 17:00 до 18:30
Россия	Гаврилково (Красногорск, Московская область)	Встреча	д.Гаврилково ул. Фабричная д. 47Б (Храм Сретения Господня). Пояснение: Собрания проходят в трапезной рядом с храмом. Схему проезда - см.на сайте храма: https://гаврилково-храм.рф/контакты/. Веб-представительство: https://t.me/+l4C3X_tbwi1hMTEy. Телефон: 89104848477. Контактное лицо: Елена. E-mail: sretenie_vda@rambler.ru	Воскресенье: с 18:00 до 20:00
