Россия	Глазов	Душа	ул. Первомайская, 1. Подвальное помещение у первого подъезда. Веб-представительство: https://chat.whatsapp.com/KO0XiyVvrHfGXscBSSkgv7. Телефон: +79018695653. E-mail: vdaglazov@gmail.com	Вторник с 17:00-18:30; Суббота с 18:30-20:30
Россия	Дзержинск, Нижегородская область	Сила и Надежда	Г. Дзержинск Ул. Октябрьская д. 34 А литер Б за Пятерочкой, каб 205, 2 этаж, код на двери 8247#. Пояснение: Собрания он-лайн не проводятся. Телефон: +79200268653. Контактное лицо: Ирина	Пятница с 18:00 до 19:00
Россия	Екатеринбург	Безмятежность	Церковь Кирилла и Мефодия, ул. Вали Котика 13А. Пояснение: Собрания проходят на втором этаже Церкви. Чтобы попасть на собрание, необходимо войти в Церковь через главный вход, пройти прямо и войти в служебное помещение, подняться по лестнице на 2 этаж, повернуть налево и идти по коридору до упора. Контактное лицо: Елизавета	Вторник с 18-00 до 19-30
Россия	Екатеринбург	Возрождение	ул. Гоголя, д. 9. Пояснение: (Красный кирпичный пристрой). Телефон: +79655284674. Контактное лицо: Ирина. E-mail: vda_ekb@mail.ru	Среда с 18-30 до 20-00
Россия	Екатеринбург	Воскресенье	ул. Карла Маркса, д. 31 (здание Крестовоздвиженского мужского монастыря). Пояснение: Вход со двора. Затем сразу дверь направо и вверх по лестнице. Телефон: +79655284674. E-mail: vda_ekb@mail.ru	в воскресенье в 18:00
Россия	Екатеринбург	Группа ВДА Инсайт	г. Екатеринбург, ул. Ленина, 11 (Храм во имя святителя Иннокентия, Митрополита Московского; 1 этаж, вход в храм, направо, комната с надписью «Воскресная школа»). Пояснение: Темы собрания: Ежедневник ВДА, чтение Красной Книги, текущий опыт выздоровления. Контактное лицо: Кристина	Четверг с 18-00 до 19-15
Россия	Екатеринбург	Источник	Ул. Восточная 30А (Храм в честь иконы Божией Матери Порт-Артурская). Веб-представительство: https://t.me/+Ixkf5cGOOHk2Yjhi	Пятница 18:45 Собрание в третью пятницу месяца посвящено практике по восстановлению связи с любящим родителем
Россия	Екатеринбург	Любовь	ул. Карла Маркса, 31, Крестовоздвиженский монастырь. Веб-представительство: https://t.me/+_jfx7r8KtCg1ZjA6. Телефон: +79049804918. Контактное лицо: Кирилл	Четверг с 18:30 до 20:00
Россия	Екатеринбург	Новый уровень	"Челюскинцев, 88. Пояснение: Адрес: Челюскинцев, 88. От входа повернуть направо, идти по коридору до конца. Ориентир стрелка ""ЗОЖ. Веб-представительство: https://t.me/+JnucGdeRtfdlNjYy"	Суббота с 14:15 до 15:45
Россия	Ессентуки	ВДА Ессентуки	ул. Кисловодская 116 а. Телефон: +7 (919) 748-00-07. Контактное лицо: Константин. E-mail: Essentukivda@yandex.ru	Понедельник с 20:30 до 21:30 Четверг 20:30 до 21:30
Россия	Ессентуки	Песочные часы	г.Ессентуки, ул.Железнодорожная, д.1 офис 84. Веб-представительство: https://chat.whatsapp.com/GPF8sWHUa7iDeXfD4nXmw5?mode=ac_t. Телефон: +79280083320. Контактное лицо: Ольга. E-mail: izabella211@yandex.ru	Вторник с 18:30 до 20:00 Пятница с 18:30 до 20:00
Россия	Жуковский, Московская область	Полёт	"ул. Лацкова, 7А, 2 этаж, кабинет ""Красный зал"" (помещение Воскресной школы храма Архангела Михаила). Пояснение: Проезд: м. «Котельники», последний вагон из центра, выход №5, на автостанцию направо, затем налево до остановки «Метро Котельники · 5D__5E». Далее на автобусах № 424, 478, 441 до остановки «Улица Лацкова». От остановки — вниз по улице Лацкова до храма Архангела Михаила, помещение Воскресной школы. Уточнить актуальную информацию об изменениях в расписании, деталях проезда, а также сообщить о своём намерении присутствовать на встрече можно по телефону или в нашем чате WhatsApp. Веб-представительство: https://chat.whatsapp.com/GJnOmWxVGSv1t6xFrt8kpS. Телефон: +7 963 770-11-29. Контактное лицо: Яна. E-mail: vda-polet@yandex.ru"	Воскресенье с 18-15 до 19-45
Россия	Звенигород	Я ЕСТЬ	Ул Луначарского дом 18, частный дом, ворота с фонарями, вход в калитку. Телефон: 8-926-383-27-75 Анна 8-968-623-48-48 Наталья. E-mail: vda_iam@mail.ru	Среда с 19:00 до 20:30
Россия	Златоуст (Челябинская область)	Роса	пр. Профсоюзов, 3А. Пояснение: Очное и онлайн одновременно. Телефон: +79822896995. Контактное лицо: Наталия. E-mail: Rosa-aca@mail.ru	Пятница с 19 ( по Москве с 17:00)
Россия	Иваново	Пятница 13	ул. Советская, дом 47. Вход в реабилитационный центр. Веб-представительство: https://vda-ivanovo.ru. Телефон: 89806831716. Контактное лицо: Дмитрий Кочанов. E-mail: Dimanochnoy@mail.ru	Суббота с 19:00 до 20:15
Россия	Ижевск	Байкал	ул. 40 километр, д.29, цокольный этаж, комната №6. Пояснение: Ссылка на карту http://rlu.ru/1kd2N. Телефон: 8-912-852-35-45. Контактное лицо: Алексей. E-mail: vda.izhevsk@mail.ru	среда, воскресенье с 18:30 до 20:00
Россия	Ижевск	Летний Сад	Улица Милиционная, 4, кабинет 7. Веб-представительство: https://m.vk.com/vda_izevsk. Телефон: +7 912 852-35-45. Контактное лицо: Евгения. E-mail: vdaudmurtiya@yandex.ru	Пятница с 18-30 до 20-00
Россия	Иркутск	Путь к себе	ул. Профсоюзная 45а. Пояснение: Здание воскресной школы Николо-Иннокентьевского Храма г. Иркутска. E-mail: ksebe-irk@mail.ru	Воскресенье с 14-00 до 15-45
Россия	Иркутск	Феникс	Некрасова 12 Б, цоколь. Веб-представительство: https://vk.com/vda_irk, +7 (964)357-40-09. Телефон: +7 (964)357-40-09. Контактное лицо: Ольга	Вторник с 19-00 до 20-30
Россия	Йошкар-Ола	Феникс	Ленинский проспект дом 68 (вход с улицы, через «Семейный чемодан»). Пояснение: Адрес: г. Йошкар-Ола, Ленинский проспект 68, напротив ДК Ленина, вход крыльцо хостел Семейный чемодан, 2 этаж, 3 кабинет с правой стороны. Веб-представительство: https://vk.com/feniksola. Телефон: +7 927 682 68 84. E-mail: feniksolavda12@mail.ru	Среда 18:00-20:00 П; ятница 18:00-20:00; Воскресенье 17:00- 19:00
Россия	Казань	"Группа для женщин 18+ ""Аура"	г. Казань, ул. К. Маркса, д. 26, здание Лютеранской церкви, Сиреневый зал. Пояснение: Группа для женщин 18+. E-mail: vda_women_kazan_aura@mail.ru	Суббота 09:30 - 11:00
Россия	Казань	Дом внутри	ул. Карбышева, д. 50. Пояснение: Вход рядом с аптекой «Саулык», 2 этаж, офис 13, код домофона «5В». Веб-представительство: https://t.me/+cIpZl2J-kmxjMDFi	Среда с 18-30 до 20-15
Россия	Казань	На Сенной	ул. Московская, 39. Пояснение: Зайти во двор, пройти мимо здания церкви из красного кирпича, повернуть налево, идти до упора до трёхэтажного здания с табличкой «Православная психологическая служба», подняться на 3-й этаж, идти в кабинет прямо по коридору до упора. Веб-представительство: У группы есть чат в Telegram, в который можно добавиться после посещения первого собрания	Среда с 19:15 до 20:45
Россия	Казань	Прогресс	ул. Сафиуллина, 50а. Веб-представительство: https://t.me/vdaprogress. Контактное лицо: Аделина. E-mail: vda.progress.kazan@gmail.com	Вторник с 19-00 до 20-45
Россия	Казань	Сияние	ул Карла Маркса, 26. Пояснение: Заходить в правую дверь (та, что рядом с КЦ им.Пушкина), подняться на 2, 5 этаж (чуть выше второго этажа). Веб-представительство: Есть WhatsApp. Телефон: +7 (965) 600-89-70. Контактное лицо: Лилия. E-mail: LovelyParent@yandex.ru	Пятница с 19:00 до 20:30.
Россия	Казань	Степ	Ул.Мавлютова, д.14, за рынком, здание надо обойти, вход рядом с ателье, 3 этаж, кабинет 2. Контактное лицо: Алина. E-mail: step_kazan@mail.ru	Воскресенье с 16:00 до 17:30
Россия	Казань (Татарстан)	Ветер	ул. Карла Маркса, д. 26. Телефон: +7(965)600-89-70. Контактное лицо: Елизавета. E-mail: veterkzn@yandex.ru	СБ: 17:00—18:30
Россия	Казань (Татарстан)	Норвегия	ул. Чистопольская, 19а (бизнес-центр «Арго»), оф. 35. Пояснение: Бизнес-центр «Арго», 3-й этаж. В понедельник собрания проходят в дальней комнате рядом с кухней. Открытое собрание в третий понедельник месяца. В четверг собрания проходят в комнате рядом со входом. Открытое собрание в первый четверг месяца. Веб-представительство: https://vk.com/vda_kazan. Телефон: +7 965 600 89 70 телефон общегородской, можно звонить с 10ч. до 22ч. Контактное лицо: Альмир. E-mail: vdanorvegiyakazan@mail.ru	Понедельник с 19:00 до 20:45; Четверг с 19:00 до 20:45.
Россия	Калининград	Взросление	Пр. Мира 7, здание «Морской дом», кабинет 506, 5 этаж. Телефон: +79114942555. Контактное лицо: Александра	Суббота с 12:00-13:30
Россия	Калининград	КосмАнавты	ул. Сухумская, 7, р-он А.Космодемьянского, трапезная. Пояснение: Собрания проходят в трапезной, здание напротив храма. Телефон: +79969593181. Контактное лицо: Андрей. E-mail: medbrataa@gmail.com	Суббота с 19-00 до 20-30
Россия	Калининград	Принятие себя	ул. Александра Невского д. 78в. Пояснение: за католической церковью ( если обойти справа), в двухэтажном здании, кабинет 8. Веб-представительство: Viber. Телефон: +7 (952) 116-90-55	1. г. Калининград, ул. Александра Невского д. 78в каб. 8: - Понедельник 11:00 - 12:30; - Четверг 19:00 - 20:30; - Суббота 15:00 - 16:30; 2. г. Калининград, ул. Барнаульская, д. 6а (третий этаж, зал колл-центра): - Вторник 19:00 - 20:30
Россия	Калуга	Четвертое июня	Ул. Ленина, 73 (двухэтажное здание ) ком. 14. Веб-представительство: +7 953 461-47-72 WhatsApp Галина. Телефон: +7 953 461-47-72. Контактное лицо: Галина. E-mail: vdakaluga@yandex.ru	Понедельник 18:30 - 20:00
Россия	Каменск-Шахтинский	День за днем	Пр. Карла Маркса д.9, цокольный этаж. Пояснение: Ссылка для подключения к нам онлайн https://telemost.yandex.ru/j/95353608015007. Веб-представительство: https://max.ru/join/6ucLy2CCm4-B04MpeW60utvitKjst5hjIk6iH-5xE6Y. Телефон: +79094120738. Контактное лицо: Анастасия	Понедельник с 19:00 до 20:00
Россия	Кемерово	Мои чувства	Пр. Октябрьский тц Спутник 2этаж, кафе. Веб-представительство: WhatsApp. Телефон: 89133353171	Четверг 13:30- 15:00
Россия	Керчь	Будем жить	г. Керчь, ул Кирова, д. 22, оф. 6, 4 этаж. Веб-представительство: https://t.me/vdakerch. Телефон: +79789353755. Контактное лицо: Ольга	Понедельник с 17:00 до 18:00
Россия	Киржач (Владимир)	Говори, доверяй, чувствуй!	г.Киржач (Владимирская область) ул. Гагарина, д.30 театр Совенок 2 этаж. Веб-представительство: https://chat.whatsapp.com/GCBUmE0uu7v23r5po8rIeM. Телефон: +79157717416	Каждую среду с 19-00 до 20-30
Россия	Киров	Цвета жизни	ул. Молодой гвардии, 43 Б, 412 офис. Веб-представительство: https://chat.whatsapp.com/CPQ4YJmR7tEIJkY446Wpdm. Телефон: +79195261241. E-mail: Limurr@mail.ru	Суббота с 10-30 до 12-00
Россия	Кисловодск	Доверие	Ул.Андрея Губина 10 Б. Веб-представительство: https://t.me/+xOYvxihNHu5iZjYy. Телефон: +7 9286515661	Вторник 18:00
Россия	Комсомольск-на-Амуре (Хабаровский край)	Путь домой	ул. Севастопольская, д. 51, корп, 2, офис 222. Телефон: +7(909)848-39-94. Контактное лицо: Аня. E-mail: AnGo5@yandex.ru	Воскресенье с 13:00-14:00
Россия	Кострома	Взросление	улица Козуева, дом 3/46, подвальное помещение, вход с перекрестка улиц Козуева и Комсомольской, черная дверь. Пояснение: Вниз по лестнице до двери слева и пройти в неё. Пройти через комнату и коридор, до двери в конце коридора, затем пройти в неё. Веб-представительство: Telegram: https://t.me/vda_kostroma Вконтакте: https://vk.com/vda_kostroma 2ГИС: https://go.2gis.com/ssf5b2. Телефон: +79991019648. Контактное лицо: Алексей. E-mail: vda.kostroma@gmail.com	Суббота с 17:00 до 18:00 часов
Россия	Красная Поляна (Краснодарский Край)	Красная Поляна	Пгт Красная Поляна, Заповедная 9а (здание храма). Веб-представительство: https://t.me/+QnHYNf7YIX42ODgy. Контактное лицо: Катерина. E-mail: katerina.yogamind@gmail.com	Среда 19:00
Россия	Краснодар	Маяк	ул. Октябрьская, 63/ Мира, 25, 3й этаж, вход с ул. Мира, 25 во двор, за магазином «Магнит», код на калитке. Веб-представительство: Телеграм: https://t.me/+E-Xo7CypbUw4ZGJi MAX: https://max.ru/join/9IGR0iioZ_dr22roYaK2SV0hat92Ok9BejAZj_EP-cU. Телефон: +79064345365	Каждое воскресенье с 17:00-18:30 мск.
Россия	Краснодар	Озерная	Комсомольский микрорайон, ул. Горького 30, цоколь, офис 33, д вход со двора. Пояснение: ВНИМАНИЕ! В Краснодаре несколько улиц Горького, группа расположена в Комсомольском микрорайоне, на пересечении с ул. Некрасова. Вход со двора, спускаемся вниз в цокольный этаж, потом направо до конца, коричневая дверь с надписью NA. Веб-представительство: есть группа WhatsApp. Телефон: +7 900 250-33-26. Контактное лицо: Елена	Среда с 18-00 до 19-30
Россия	Краснодар	ПраВДА	Улица Аверкиева, д. 6. Веб-представительство: Телеграмм. Телефон: +79103388628. Контактное лицо: Ольга	Воскресенье с 16-00 до 17-30
Россия	Краснодар	Сказать жизни Да!	угол дома: Ул. Мира, 25 и ул. Октябрьская, 63, 3 этаж. Вход с ул. Мира за магазином Магнит в общий двор через ворота. На двери надпись МАЯК (на окнах 3-его этажа тоже написано МАЯК). Пояснение: угол дома: Ул. Мира, 25 и ул. Октябрьская, 63, 3 этаж. Вход с ул. Мира за магазином Магнит в общий двор через ворота. На двери надпись МАЯК (на окнах 3-его этажа тоже написано МАЯК). Веб-представительство: https://t.me/+N8VPz64VRvw5OTcy. Телефон: +79284339339. Контактное лицо: Зубрилина Марина	Пятница с 18-00 до 19-30
